{
  "id": "integration-design-extension",
  "title": "Integration design extension",
  "slug": "integration-design-extension",
  "description": "Identifies how a technology-agnostic integration-design journey uses the core capability method before selecting APIs, events, files, streams, data products, or direct integration.",
  "baseMethod": "core-api-method",
  "scope": {
    "appliesWhen": [
      "The integration need is known, but API is not yet the decided implementation style.",
      "The team needs technology-agnostic requirements before choosing APIs, events, files, streams, data products, or direct system integration.",
      "The outcome should still favor reusable, discoverable, governed capabilities rather than one-off point-to-point connections."
    ],
    "outOfScope": [
      "Replacing the core API method for confirmed API products.",
      "Adding technology-specific design canvases before the integration style decision is justified by requirements."
    ]
  },
  "principles": [
    {
      "id": "technology-agnostic-first",
      "title": "Stay technology agnostic until requirements justify an architecture choice",
      "description": "Early canvases should describe capability, consumers, value, data, events, volumes, controls, and service expectations without assuming REST, events, files, data products, or another integration mechanism."
    },
    {
      "id": "reusable-capabilities",
      "title": "Design reusable integration capabilities",
      "description": "The extension should keep the product-thinking strengths of the API method: clear consumers, value proposition, ownership, lifecycle, discoverability, support, metrics, and improvement."
    },
    {
      "id": "branch-late",
      "title": "Branch into API-specific design only after the integration style decision",
      "description": "REST, event, GraphQL, file, stream, data product, and direct integration design resources should be selected after requirements and constraints indicate the right architecture pattern."
    }
  ],
  "decisions": {
    "newLine": {
      "needed": false,
      "reason": "The core station names and guidance are now capability-oriented enough for integration design, so a separate public Integration Design line is not needed."
    },
    "additionalStations": {
      "needed": false,
      "reason": "The core stations cover the lifecycle. Integration design uses the same station sequence with technology-agnostic wording, capability canvases, and architecture-decision criteria."
    },
    "alternativeResources": {
      "needed": true,
      "reason": "Several existing canvases carry API-specific naming. Integration discovery needs technology-agnostic equivalents while preserving the same structure and product-thinking intent."
    },
    "integrationSpecificCriteria": {
      "needed": true,
      "reason": "Readiness should include architecture-choice evidence, capability reuse, producer and consumer commitments, operability, and data movement constraints that are broader than API readiness."
    },
    "integrationSpecificWording": {
      "needed": true,
      "reason": "Existing canvases can stay reusable if their labels and instructions are overlaid with capability, consumer, interaction, contract, and service wording instead of API-only wording."
    }
  },
  "line": {
    "id": "core-capability-method",
    "title": "Core Capability Method",
    "slug": "core-capability-method",
    "order": 3,
    "color": "#2F80ED",
    "description": "A technology-agnostic route from capability strategy to architecture choice, solution and interface design, delivery, readiness assurance, publishing, and improvement.",
    "stations": [
      "api-product-strategy",
      "api-consumer-experience",
      "api-platform-architecture",
      "api-design",
      "api-delivery",
      "api-audit",
      "api-publishing",
      "monitoring-and-improving"
    ],
    "stationIntent": [
      {
        "station": "api-product-strategy",
        "intent": "Frame the opportunity as a reusable business or ecosystem capability, not as a preselected implementation style."
      },
      {
        "station": "api-consumer-experience",
        "intent": "Describe consumers, producer responsibilities, journeys, pains, gains, service expectations, and adoption paths without assuming the integration technology."
      },
      {
        "station": "api-platform-architecture",
        "intent": "Use business impact, locations, capacity, security, privacy, governance, and operability evidence to decide the appropriate architecture."
      },
      {
        "station": "api-design",
        "intent": "After architecture choice, branch into the correct contract and interaction design resources for APIs, events, files, streams, data products, or other selected patterns."
      },
      {
        "station": "api-delivery",
        "intent": "Deliver the selected solution mechanism with lifecycle automation, testing, security, versioning, and environment controls appropriate to the chosen pattern."
      },
      {
        "station": "api-audit",
        "intent": "Audit the capability contract, data movement, controls, observability, and lifecycle readiness, not only API specification quality."
      },
      {
        "station": "api-publishing",
        "intent": "Publish discoverable capability information, onboarding paths, ownership, support, and service expectations for reuse."
      },
      {
        "station": "monitoring-and-improving",
        "intent": "Monitor usage, reliability, data quality, consumer outcomes, operational cost, and reuse opportunities across solution styles."
      }
    ]
  },
  "documentCanvasOrder": [
    "customerJourneyCanvas",
    "domainCanvas",
    "capabilityValuePropositionCanvas",
    "capabilityBusinessModelCanvas",
    "consumerExperienceRequirementsCanvas",
    "businessImpactCanvas",
    "locationsCanvas",
    "capacityCanvas"
  ],
  "documentCanvasStations": {
    "customerJourneyCanvas": "api-product-strategy",
    "domainCanvas": "api-product-strategy",
    "capabilityValuePropositionCanvas": "api-product-strategy",
    "capabilityBusinessModelCanvas": "api-product-strategy",
    "consumerExperienceRequirementsCanvas": "api-consumer-experience",
    "businessImpactCanvas": "api-platform-architecture",
    "locationsCanvas": "api-platform-architecture",
    "capacityCanvas": "api-platform-architecture"
  },
  "stationOverlays": [
    {
      "station": "api-product-strategy",
      "title": "Integration capability strategy",
      "reuse": [
        "customerJourneyCanvas",
        "domainCanvas",
        "businessImpactCanvas"
      ],
      "alternativeResources": [
        "capabilityValuePropositionCanvas",
        "capabilityBusinessModelCanvas"
      ],
      "wording": {
        "api": "integration capability",
        "api product": "reusable capability",
        "developer": "consumer or integrating team",
        "API consumer": "capability consumer"
      }
    },
    {
      "station": "api-consumer-experience",
      "title": "Integration consumer and producer experience",
      "reuse": [
        "customerJourneyCanvas",
        "api-onboarding-best-practices"
      ],
      "alternativeResources": [
        "consumerExperienceRequirementsCanvas",
        "capabilityOnboardingGuidelines"
      ],
      "wording": {
        "API consumer": "capability consumer",
        "API provider": "capability owner or producer",
        "onboarding": "integration onboarding"
      }
    },
    {
      "station": "api-platform-architecture",
      "title": "Integration architecture decision",
      "reuse": [
        "businessImpactCanvas",
        "locationsCanvas",
        "capacityCanvas",
        "api-metrics-and-analytics",
        "data-privacy-guidelines",
        "api-security-best-practices"
      ],
      "alternativeResources": [
        "integrationStyleDecisionRecord",
        "integrationArchitectureOptionsCanvas",
        "dataMovementAndOwnershipCanvas"
      ],
      "wording": {
        "API platform": "integration platform or enabling platform",
        "endpoint": "integration access point",
        "traffic": "demand, throughput, events, batches, or data volume"
      }
    },
    {
      "station": "api-design",
      "title": "Integration solution design",
      "reuse": [
        "domainCanvas",
        "interactionCanvas",
        "restCanvas",
        "eventCanvas",
        "graphqlCanvas",
        "contract-first-design"
      ],
      "alternativeResources": [
        "capabilityContractCanvas",
        "fileExchangeCanvas",
        "dataProductCanvas",
        "streamingIntegrationCanvas"
      ],
      "wording": {
        "API design": "integration solution design",
        "API contract": "capability contract",
        "resource": "business object, event, dataset, file, or operation"
      }
    },
    {
      "station": "api-delivery",
      "title": "Integration delivery",
      "reuse": [
        "api-development-best-practices",
        "api-testing-best-practices",
        "apiops-CI-CD-for-apis",
        "api-security-best-practices"
      ],
      "alternativeResources": [
        "integrationDeliveryChecklist",
        "integrationTestStrategy"
      ],
      "wording": {
        "API pipeline": "integration delivery pipeline",
        "contract test": "capability contract and data movement test"
      }
    },
    {
      "station": "api-audit",
      "title": "Integration readiness audit",
      "reuse": [
        "api-audit-checklist",
        "api-compliance-best-practices"
      ],
      "alternativeResources": [
        "integrationReadinessChecklist"
      ],
      "wording": {
        "API audit": "integration readiness audit",
        "API description": "capability description and contract"
      }
    },
    {
      "station": "api-publishing",
      "title": "Capability publishing",
      "reuse": [